{
  "$schema": "https://json-schema.org/draft/2020-12/schema",
  "title": "VLLNT UI design tokens",
  "type": "object",
  "required": [
    "name",
    "version",
    "source",
    "color",
    "typography",
    "spacing",
    "radius",
    "elevation",
    "motion",
    "iconography"
  ],
  "properties": {
    "$schema": { "type": "string" },
    "name": { "const": "VLLNT UI" },
    "version": { "type": "string", "pattern": "^[0-9]+\\.[0-9]+\\.[0-9]+$" },
    "source": {
      "type": "object",
      "required": ["guide", "theme"],
      "properties": {
        "guide": { "type": "string" },
        "theme": { "type": "string" }
      },
      "additionalProperties": false
    },
    "color": {
      "type": "object",
      "required": ["format", "semantic"],
      "properties": {
        "format": { "const": "oklch-channel" },
        "semantic": {
          "type": "object",
          "minProperties": 1,
          "additionalProperties": { "$ref": "#/$defs/semanticColor" }
        }
      },
      "additionalProperties": false
    },
    "typography": {
      "type": "object",
      "required": ["fontFamily", "fontWeight", "scale"],
      "properties": {
        "fontFamily": {
          "type": "object",
          "additionalProperties": { "$ref": "#/$defs/fontFamily" }
        },
        "fontWeight": {
          "type": "object",
          "additionalProperties": { "$ref": "#/$defs/fontWeight" }
        },
        "scale": {
          "type": "object",
          "additionalProperties": { "$ref": "#/$defs/typeScale" }
        }
      },
      "additionalProperties": false
    },
    "spacing": {
      "type": "object",
      "required": ["unit", "scale"],
      "properties": {
        "unit": { "$ref": "#/$defs/cssLength" },
        "scale": { "$ref": "#/$defs/stringMap" }
      },
      "additionalProperties": false
    },
    "radius": { "$ref": "#/$defs/stringMap" },
    "elevation": { "$ref": "#/$defs/stringMap" },
    "motion": {
      "type": "object",
      "required": ["duration", "easing", "reducedMotion"],
      "properties": {
        "duration": { "$ref": "#/$defs/stringMap" },
        "easing": { "$ref": "#/$defs/stringMap" },
        "reducedMotion": { "type": "string", "minLength": 1 }
      },
      "additionalProperties": false
    },
    "iconography": {
      "type": "object",
      "required": ["library", "size", "strokeWidth", "color"],
      "properties": {
        "library": { "type": "string", "minLength": 1 },
        "size": { "$ref": "#/$defs/stringMap" },
        "strokeWidth": { "type": "number", "exclusiveMinimum": 0 },
        "color": { "type": "string", "minLength": 1 }
      },
      "additionalProperties": false
    }
  },
  "$defs": {
    "cssLength": {
      "type": "string",
      "pattern": "^-?[0-9]+(?:\\.[0-9]+)?(?:px|rem|em|%)$"
    },
    "cssVariable": {
      "type": "string",
      "pattern": "^--[a-z][a-z0-9-]*$"
    },
    "fontFamily": {
      "type": "object",
      "required": ["cssVariable", "value", "role"],
      "properties": {
        "cssVariable": { "$ref": "#/$defs/cssVariable" },
        "value": { "type": "string", "minLength": 1 },
        "role": { "type": "string", "minLength": 1 }
      },
      "additionalProperties": false
    },
    "fontWeight": {
      "type": "object",
      "required": ["value"],
      "properties": {
        "cssVariable": { "$ref": "#/$defs/cssVariable" },
        "value": { "type": "integer", "minimum": 1, "maximum": 1000 },
        "role": { "type": "string", "minLength": 1 }
      },
      "additionalProperties": false
    },
    "oklchChannel": {
      "type": "string",
      "pattern": "^(?:0(?:\\.[0-9]+)?|1(?:\\.0+)?) (?:0(?:\\.[0-9]+)?|1(?:\\.0+)?) -?[0-9]+(?:\\.[0-9]+)?$"
    },
    "semanticColor": {
      "type": "object",
      "required": ["cssVariable", "light", "dark", "role"],
      "properties": {
        "cssVariable": { "$ref": "#/$defs/cssVariable" },
        "light": { "$ref": "#/$defs/oklchChannel" },
        "dark": { "$ref": "#/$defs/oklchChannel" },
        "role": { "type": "string", "minLength": 1 }
      },
      "additionalProperties": false
    },
    "stringMap": {
      "type": "object",
      "minProperties": 1,
      "additionalProperties": { "type": "string", "minLength": 1 }
    },
    "typeScale": {
      "type": "object",
      "required": [
        "cssVariable",
        "fontSize",
        "lineHeight",
        "lineHeightCssVariable"
      ],
      "properties": {
        "cssVariable": { "$ref": "#/$defs/cssVariable" },
        "fontSize": { "$ref": "#/$defs/cssLength" },
        "lineHeight": { "type": "string", "pattern": "^[0-9]+(?:\\.[0-9]+)?$" },
        "lineHeightCssVariable": { "$ref": "#/$defs/cssVariable" }
      },
      "additionalProperties": false
    }
  },
  "additionalProperties": false
}
